{"$schema": "https://json-schema.org/draft/2020-12/schema", "title": "ficha.json — fuente única de verdad de un proyecto", "type": "object", "required": ["version", "proyecto", "cliente", "tipologia", "requisitos", "diseno", "comercial", "estado"], "properties": {"version": {"const": 1}, "proyecto": {"type": "object", "required": ["marca", "numero", "fecha", "validez_dias", "titulo"], "properties": {"marca": {"type": "string"}, "numero": {"type": "string"}, "fecha": {"type": "string", "format": "date"}, "validez_dias": {"type": "integer"}, "titulo": {"type": "string"}}}, "cliente": {"type": "object", "required": ["localidad", "provincia"], "properties": {"nombre": {"type": ["string", "null"]}, "contacto": {"type": ["string", "null"]}, "localidad": {"type": "string"}, "provincia": {"type": "string"}, "zona_compras": {"type": ["string", "null"]}, "direccion_obra": {"type": ["string", "null"]}}}, "tipologia": {"enum": ["portico-hamacas", "jaula-cerdas"], "description": "Define material base (madera o hierro), módulo del motor y si lleva presupuesto (catalogo/tipologias/<id>.json)."}, "requisitos": {"type": "object", "description": "Requisitos del cliente; las claves dependen de la tipología (ver ejemplos/<tipologia>/ficha.json)."}, "diseno": {"type": "object", "description": "Medidas en mm. Pórtico: material, travesano, patas, tirante, cartela, varillas, cuelgues, accesorios, apoyo (ejemplos/pueblo-andino). Jaula: box, tubos, largueros_z, parantes_x, puerta, frente, pie, comedero, caida, dosificador, rfid, previsiones, con _origen (fuente/criterio/supuesto) en cada bloque (ejemplos/jaula-cerdas)."}, "comercial": {"type": "object", "required": ["iva_pct", "mostrar_con_iva", "mod"], "properties": {"iva_pct": {"type": "number"}, "mostrar_con_iva": {"type": "boolean"}, "incluye_flete": {"const": false}, "mod": {"type": "object", "properties": {"incluida": {"type": "boolean"}, "texto": {"type": "string"}}}, "plazo_entrega": {"type": ["string", "null"]}, "garantia": {"type": ["string", "null"]}, "anexo_autoconstruccion": {"type": "boolean"}}}, "estado": {"type": "object", "properties": {"validacion_aprobada": {"type": "boolean"}, "vueltas_auditoria": {"type": "integer"}}}}, "allOf": [{"if": {"properties": {"tipologia": {"const": "portico-hamacas"}}}, "then": {"properties": {"requisitos": {"type": "object", "required": ["uso", "configuraciones", "carga_diseno_kg", "factor_dinamico", "carga_por_puesto_kg", "espacio"], "properties": {"configuraciones": {"type": "array", "items": {"type": "object", "required": ["id", "nombre", "puestos"], "properties": {"puestos": {"type": "array", "items": {"enum": ["hamaca", "trapecio", "escalera", "cama"]}}}}}, "espacio": {"type": "object", "required": ["largo_eje_travesano_m", "largo_vaiven_m"]}, "superficie": {"enum": ["al_ras", "suelta", null], "description": "Superficie bajo las hamacas (EN 1176-2, 4.10.2): al_ras (césped, sintético) o suelta (arena, chips). Si falta, se usa suelta."}}}}}}, {"if": {"properties": {"tipologia": {"const": "jaula-cerdas"}}}, "then": {"properties": {"requisitos": {"type": "object", "required": ["uso", "galpon", "linea_alimento"], "properties": {"galpon": {"type": "object", "required": ["slat"]}, "linea_alimento": {"type": "object", "required": ["z", "diam"]}, "cantidad_boxes": {"type": "integer", "minimum": 1}}}, "diseno": {"type": "object", "required": ["box", "tubos", "largueros_z", "parantes_x", "puerta", "frente", "pie", "comedero", "caida", "dosificador", "rfid"], "properties": {"pie": {"type": "object", "required": ["pletina", "m10_y", "m12_y"]}}}}}}]}